{
  "fixture_id": "python-service-synthetic",
  "license": "MIT",
  "license_path": "LICENSE",
  "license_sha256": "c5dfbaa5f716f470a4c096a88726a7e12a1959c8f89ffe86640457adeb9046f0",
  "revision": "8ce402c50e7318d2164ffe420507afdcc9829b0d",
  "schema_version": "1.0",
  "setup_files": [
    {
      "path": "LICENSE",
      "sha256": "c5dfbaa5f716f470a4c096a88726a7e12a1959c8f89ffe86640457adeb9046f0"
    },
    {
      "path": "pyproject.toml",
      "sha256": "983d4db918665a0616b3b0d7ca903ccfd3ae0eb989021cf0643743f29f007e84"
    },
    {
      "path": "service.py",
      "sha256": "95bd92f36063c93d829df20e1c1b55cf4b930284f35b12ea29b8da467fc7225c"
    },
    {
      "path": "tests/test_service.py",
      "sha256": "554ab1f3abe4bc6bd58a7db823b63fda097438ea2815cd52e8ba897f6a736735"
    },
    {
      "path": "uv.lock",
      "sha256": "bc9596d5336a617e9c7da6a1101313833ec4065e3797d7ebea30ff89a1d27908"
    }
  ],
  "source_url": "https://github.com/marco0560/codira",
  "transport": "directory-snapshot",
  "tree_sha": "8ce402c50e7318d2164ffe420507afdcc9829b0d",
  "visibility": "public"
}
