{
  "fixture_id": "codira-public",
  "license": "MIT",
  "license_path": "LICENSE",
  "license_sha256": "c5dfbaa5f716f470a4c096a88726a7e12a1959c8f89ffe86640457adeb9046f0",
  "revision": "9b6f97ec400d731f1ce2cf2746c86c7fc7747ef2",
  "schema_version": "1.0",
  "setup_files": [
    {"path": "pyproject.toml", "sha256": "7434bfad2b39d3511c6e01c538c908b5b2d03a5db285ba66b5e2aabb744064b4"},
    {"path": "uv.lock", "sha256": "566b5174adb0c3db4524ab785fcea613efd3482155934452754b191e33559f39"}
  ],
  "source_url": "https://github.com/marco0560/codira",
  "transport": "git-archive",
  "tree_sha": "ae0f94d23e58b04820b1c60d930f288e70d952cf",
  "visibility": "public"
}
